{
  "name": "Qwen3.8 Flash Next",
  "source": "https://huggingface.co/Qwen/Qwen3.8-Flash-Next",
  "verified_at": "2026-10-01",
  "max_tokens": 32768,
  "complex_problem_max_tokens": 81920,
  "hard_limit_reply_budget": 8192,
  "thinking_terminator_hint": "Considering the limited time by the user, I have to give the solution based on the thinking directly now.\n</think>\n\n",
  "sampling": {
    "temperature": 1.0,
    "top_p": 0.95,
    "top_k": 20,
    "min_p": 0.0,
    "presence_penalty": 0.0,
    "repetition_penalty": 1.0
  },
  "notes": "Thinking-mode sampling from the model card and generation_config.json. The card allows up to 262,144 reasoning + 131,072 answer tokens; max_tokens stays within lucebox context budgets. The 8,192-token reply reserve covers the visible restatement this model writes after a forced close. The terminator is Qwen's budget-forcing text (QwenLM/Qwen3 quickstart). Unsloth UD and bartowski GGUFs report general.name 'Qwen3.8 Flash Next'."
}
