{
  "name": "Gemma 4 26B-A4B IT",
  "source": "https://huggingface.co/google/gemma-4-26B-A4B-it",
  "verified_at": "2026-05-24",
  "download_urls": {
    "Q4_K_M-target": "https://huggingface.co/bartowski/google_gemma-4-26B-A4B-it-GGUF/resolve/main/google_gemma-4-26B-A4B-it-Q4_K_M.gguf",
    "Q5_K_M-target": "https://huggingface.co/bartowski/google_gemma-4-26B-A4B-it-GGUF/resolve/main/google_gemma-4-26B-A4B-it-Q5_K_M.gguf",
    "Q8_0-target":   "https://huggingface.co/bartowski/google_gemma-4-26B-A4B-it-GGUF/resolve/main/google_gemma-4-26B-A4B-it-Q8_0.gguf",
    "DFlash-draft":  "https://huggingface.co/Lucebox/gemma-4-26B-A4B-it-DFlash-GGUF/resolve/main/gemma-4-26B-A4B-it-DFlash-q8_0.gguf"
  },
  "notes": "Gemma 4 26B-A4B IT — multimodal MoE (25.2B total / 3.8B active / 128 experts, 8 active + 1 shared). Reasoning-capable via `<|think|>` token at start of system prompt. Native 256K context. Target GGUFs are community quantizations by bartowski; the DFlash drafter is published by Lucebox.",
  "max_tokens": 16384,
  "hard_limit_reply_budget": 4096,
  "sampling": {
    "temperature": 1.0,
    "top_p": 0.95,
    "top_k": 64,
    "min_p": 0.0,
    "presence_penalty": 0.0,
    "repetition_penalty": 1.0
  }
}
